{
  "$schema": "./experiment-manifest.schema.json",
  "manifestVersion": "1.0",
  "experimentId": "acs-ccv-r1",
  "roundId": "all-rounds",
  "status": "EXPERIMENT_REPORTED_INDEPENDENT_REPRODUCTION_NOT_POSSIBLE",
  "rightsLabels": [
    "SYNTHETIC_TEST_ONLY",
    "NOT_FOR_PRODUCTION"
  ],
  "historicalExecutionDate": "2026-08-14",
  "manifestCreatedAt": null,
  "historicalScriptBytesRecovered": false,
  "hardenedSuccessorScripts": [
    {
      "role": "hardened_successor_script",
      "logicalName": "character_consistency_test.py",
      "sizeBytes": 430,
      "sha256": "ccd267f1004f8a92ab412bfe5869ea9d76495bc84ff453c4bfde0ab419c35e26"
    },
    {
      "role": "hardened_successor_script",
      "logicalName": "ipadapter_face_test.py",
      "sizeBytes": 430,
      "sha256": "8ee4b05458f8be1599a59f3bc736d5613d83c4a6ccf5d5f14d44af9aa4d3d0f8"
    },
    {
      "role": "hardened_successor_script",
      "logicalName": "ipadapter_pose_test.py",
      "sizeBytes": 430,
      "sha256": "2a28c2509b01ca780284c2347ee19083eee6bcb98f77d228696388ba8dc15053"
    },
    {
      "role": "hardened_successor_script",
      "logicalName": "evidence_common.py",
      "sizeBytes": 27756,
      "sha256": "42b0337d3fbecf256902b44dde2502fd7c2a9bbd8cda5f8b44c3e8d7425caba2"
    }
  ],
  "environment": {
    "round-1": {
      "hardware": "NVIDIA A100-PCIE-40GB",
      "cuda": "12.6",
      "python": "3.12.7",
      "pytorch": "2.13.0+cu126",
      "comfyuiVersionReported": "0.28.0",
      "comfyuiCommit": null,
      "customNodes": [],
      "driver": "560.35.03",
      "collectionState": "PENDING_EXACT_EXTERNAL_EVIDENCE"
    },
    "round-2": {
      "hardware": "NVIDIA A100-PCIE-40GB",
      "cuda": "12.6",
      "python": "3.12.7",
      "pytorch": "2.13.0+cu126",
      "comfyuiVersionReported": "0.28.0",
      "comfyuiCommit": null,
      "customNodes": [
        {
          "name": "ComfyUI_IPAdapter_plus",
          "commit": null
        }
      ],
      "driver": "560.35.03",
      "collectionState": "PENDING_EXACT_EXTERNAL_EVIDENCE"
    },
    "round-3": {
      "hardware": "NVIDIA A100-PCIE-40GB",
      "cuda": "12.6",
      "python": "3.12.7",
      "pytorch": "2.13.0+cu126",
      "comfyuiVersionReported": "0.28.0",
      "comfyuiCommit": null,
      "customNodes": [
        {
          "name": "ComfyUI_IPAdapter_plus",
          "commit": null
        }
      ],
      "driver": "560.35.03",
      "collectionState": "PENDING_EXACT_EXTERNAL_EVIDENCE"
    }
  },
  "models": [
    {
      "roundId": "round-1",
      "role": "base",
      "logicalName": "sd_xl_base_1.0.safetensors",
      "filePath": null,
      "sizeBytes": null,
      "sha256": null,
      "modelFamily": "sdxl",
      "conditioningDimension": 2048,
      "source": "PENDING_COLLECTION_FROM_EXTERNAL_GPU",
      "licenseStatus": "PENDING_VERIFICATION"
    },
    {
      "roundId": "round-2",
      "role": "base",
      "logicalName": "sd_xl_base_1.0.safetensors",
      "filePath": null,
      "sizeBytes": null,
      "sha256": null,
      "modelFamily": "sdxl",
      "conditioningDimension": 2048,
      "source": "PENDING_COLLECTION_FROM_EXTERNAL_GPU",
      "licenseStatus": "PENDING_VERIFICATION"
    },
    {
      "roundId": "round-2",
      "role": "identity_adapter",
      "logicalName": "ip-adapter-plus-face_sdxl_vit-h.safetensors",
      "filePath": null,
      "sizeBytes": null,
      "sha256": null,
      "modelFamily": "sdxl",
      "conditioningDimension": 2048,
      "source": "PENDING_COLLECTION_FROM_EXTERNAL_GPU",
      "licenseStatus": "PENDING_VERIFICATION"
    },
    {
      "roundId": "round-2",
      "role": "image_encoder",
      "logicalName": "CLIP-ViT-H-14-laion2B-s32B-b79K.safetensors",
      "filePath": null,
      "sizeBytes": null,
      "sha256": null,
      "modelFamily": "clip-vit-h",
      "conditioningDimension": 1024,
      "source": "PENDING_COLLECTION_FROM_EXTERNAL_GPU",
      "licenseStatus": "PENDING_VERIFICATION"
    },
    {
      "roundId": "round-3",
      "role": "base",
      "logicalName": "sd_xl_base_1.0.safetensors",
      "filePath": null,
      "sizeBytes": null,
      "sha256": null,
      "modelFamily": "sdxl",
      "conditioningDimension": 2048,
      "source": "PENDING_COLLECTION_FROM_EXTERNAL_GPU",
      "licenseStatus": "PENDING_VERIFICATION"
    },
    {
      "roundId": "round-3",
      "role": "identity_adapter",
      "logicalName": "ip-adapter-plus-face_sdxl_vit-h.safetensors",
      "filePath": null,
      "sizeBytes": null,
      "sha256": null,
      "modelFamily": "sdxl",
      "conditioningDimension": 2048,
      "source": "PENDING_COLLECTION_FROM_EXTERNAL_GPU",
      "licenseStatus": "PENDING_VERIFICATION"
    },
    {
      "roundId": "round-3",
      "role": "image_encoder",
      "logicalName": "CLIP-ViT-H-14-laion2B-s32B-b79K.safetensors",
      "filePath": null,
      "sizeBytes": null,
      "sha256": null,
      "modelFamily": "clip-vit-h",
      "conditioningDimension": 1024,
      "source": "PENDING_COLLECTION_FROM_EXTERNAL_GPU",
      "licenseStatus": "PENDING_VERIFICATION"
    },
    {
      "roundId": "round-3",
      "role": "pose_control",
      "logicalName": "controlnet-openpose-sdxl.safetensors",
      "filePath": null,
      "sizeBytes": null,
      "sha256": null,
      "modelFamily": "sdxl",
      "conditioningDimension": 2048,
      "source": "PENDING_COLLECTION_FROM_EXTERNAL_GPU",
      "licenseStatus": "PENDING_VERIFICATION"
    }
  ],
  "artifacts": [
    {
      "roundId": "round-1",
      "role": "comfyui_workflow",
      "logicalName": "round-1.api.json",
      "filePath": null,
      "sizeBytes": null,
      "sha256": null
    },
    {
      "roundId": "round-1",
      "role": "historical_run_log",
      "logicalName": "round-1.log",
      "filePath": null,
      "sizeBytes": null,
      "sha256": null
    },
    {
      "roundId": "round-2",
      "role": "comfyui_workflow",
      "logicalName": "round-2.api.json",
      "filePath": null,
      "sizeBytes": null,
      "sha256": null
    },
    {
      "roundId": "round-2",
      "role": "full_body_reference",
      "logicalName": "consistency_fixed_01_medium_front.png",
      "filePath": null,
      "sizeBytes": null,
      "sha256": null
    },
    {
      "roundId": "round-2",
      "role": "face_crop_reference",
      "logicalName": "consistency_fixed_01_medium_front_face_crop.png",
      "filePath": null,
      "sizeBytes": null,
      "sha256": null
    },
    {
      "roundId": "round-2",
      "role": "historical_run_log",
      "logicalName": "round-2.log",
      "filePath": null,
      "sizeBytes": null,
      "sha256": null
    },
    {
      "roundId": "round-3",
      "role": "comfyui_workflow",
      "logicalName": "round-3.api.json",
      "filePath": null,
      "sizeBytes": null,
      "sha256": null
    },
    {
      "roundId": "round-3",
      "role": "face_crop_reference",
      "logicalName": "consistency_fixed_01_medium_front_face_crop.png",
      "filePath": null,
      "sizeBytes": null,
      "sha256": null
    },
    {
      "roundId": "round-3",
      "role": "pose_skeleton",
      "logicalName": "01_medium_front_coco18.png",
      "filePath": null,
      "sizeBytes": null,
      "sha256": null
    },
    {
      "roundId": "round-3",
      "role": "pose_skeleton",
      "logicalName": "02_closeup_side_coco18.png",
      "filePath": null,
      "sizeBytes": null,
      "sha256": null
    },
    {
      "roundId": "round-3",
      "role": "pose_skeleton",
      "logicalName": "03_full_walking_coco18.png",
      "filePath": null,
      "sizeBytes": null,
      "sha256": null
    },
    {
      "roundId": "round-3",
      "role": "pose_skeleton",
      "logicalName": "04_back_turning_coco18.png",
      "filePath": null,
      "sizeBytes": null,
      "sha256": null
    },
    {
      "roundId": "round-3",
      "role": "pose_skeleton",
      "logicalName": "05_sitting_high_coco18.png",
      "filePath": null,
      "sizeBytes": null,
      "sha256": null
    },
    {
      "roundId": "round-3",
      "role": "historical_run_log",
      "logicalName": "round-3.log",
      "filePath": null,
      "sizeBytes": null,
      "sha256": null
    }
  ],
  "expectedRunCount": 50,
  "runs": [
    {
      "runId": "r1-fixed__shotId-01_medium_front",
      "roundId": "round-1",
      "batchId": "r1-fixed",
      "shotId": "01_medium_front",
      "parameters": {
        "positivePrompt": "a young woman, 20 years old, long straight black hair, brown eyes, red leather jacket, white t-shirt, blue jeans",
        "negativePrompt": "lowres, bad anatomy, bad hands, blurry, watermark, text, deformed face",
        "width": 512,
        "height": 768,
        "steps": 25,
        "cfg": 7.0,
        "sampler": "dpmpp_2m",
        "scheduler": "karras",
        "identityMethod": "text-only",
        "poseControl": "none",
        "seed": 123456,
        "seedMode": "fixed",
        "shotId": "01_medium_front"
      },
      "output": {
        "logicalPath": "outputs/r1-fixed/01_medium_front.png",
        "sizeBytes": null,
        "sha256": null
      },
      "runState": "PENDING_EXTERNAL_EVIDENCE",
      "failure": null,
      "retryOfRunId": null,
      "excluded": false,
      "exclusionReason": null
    },
    {
      "runId": "r1-fixed__shotId-02_closeup_side",
      "roundId": "round-1",
      "batchId": "r1-fixed",
      "shotId": "02_closeup_side",
      "parameters": {
        "positivePrompt": "a young woman, 20 years old, long straight black hair, brown eyes, red leather jacket, white t-shirt, blue jeans",
        "negativePrompt": "lowres, bad anatomy, bad hands, blurry, watermark, text, deformed face",
        "width": 512,
        "height": 768,
        "steps": 25,
        "cfg": 7.0,
        "sampler": "dpmpp_2m",
        "scheduler": "karras",
        "identityMethod": "text-only",
        "poseControl": "none",
        "seed": 123456,
        "seedMode": "fixed",